{
	"schemaVersion": "equipment-rank-first-provenance-result-v3",
	"resultId": "result-material-equipment-v3-drakescale-light-armour-full-set-v3-attempt-1",
	"targetId": "material-equipment-v3-drakescale-light-armour-full-set-v3",
	"assignmentId": "assignment-material-equipment-v3-drakescale-light-armour-full-set-v3",
	"attempt": 1,
	"status": "succeeded",
	"startedAt": "2026-09-03T13:50:40.348Z",
	"completedAt": "2026-09-03T13:54:49.290Z",
	"provider": "OpenAI image generation",
	"model": "gpt-imagegen-2.0",
	"promptSha256": "a54e0ecd88d24b8717bea580d5aee19699147806850cb79ed265a77451bd18be",
	"references": [
		{
			"path": "assets/equipment/experiments/material-equipment-v3/direction/class-progressions/light-armour-hide-scale-ranks-v3.png",
			"sha256": "4aeead1698bd2e6ba26e8c007c92248288c452b0254c4bb16fc09f4ca5e7a4a9",
			"purpose": "Requires owner checkpoint 1 acceptance for rank escalation, silhouettes, finish, camera, and empty-set treatment."
		},
		{
			"path": "assets/equipment/experiments/material-vs-class-calibration-2026-09-02/approach-a-steel-material-cohort-v1.png",
			"sha256": "6749ad1a65b995f48b89b0c1c8c8ee051da145315f5fd60775803f691ad7b887",
			"purpose": "Accepted painterly finish and cross-class material-coherence reference; do not copy geometry."
		}
	],
	"source": {
		"path": "/home/joao/.codex/generated_images/01a05d9f-98a4-7632-b46c-592ff8d726ac/exec-73dbf23f-ccef-4f44-8af5-864d96bd398e.png",
		"sha256": "454c263666cd342adaabd2b0e26396260a86ce5bc81b2af1589433297214ac33",
		"bytes": 1962223,
		"width": 1254,
		"height": 1254,
		"mediaType": "image/png"
	},
	"persistenceOperation": "exclusive-normalize",
	"output": {
		"path": "assets/equipment/experiments/material-equipment-v3/candidates/b/drakescale/light-armour-full-set-v3.png",
		"sha256": "175834e6870944b8226ad8d677ef94423a7237c82c5cfe23b9cc7c744bbb6663",
		"bytes": 1427101,
		"width": 1024,
		"height": 1536,
		"mediaType": "image/png"
	},
	"error": null
}
