{
	"schemaVersion": "equipment-rank-first-provenance-result-v3",
	"resultId": "result-material-equipment-v3-chitin-light-armour-legs-v3-attempt-2",
	"targetId": "material-equipment-v3-chitin-light-armour-legs-v3",
	"assignmentId": "revision-assignment-material-equipment-v3-chitin-light-armour-legs-v3-attempt-2",
	"attempt": 2,
	"status": "succeeded",
	"startedAt": "2026-09-03T18:11:20.919Z",
	"completedAt": "2026-09-03T18:12:42.486Z",
	"provider": "OpenAI image generation",
	"model": "gpt-imagegen-2.0",
	"promptSha256": "8b4f6501be51be924fde9501d075d36dce7db3399afc7c13ffad71fe5cd6ae24",
	"references": [
		{
			"path": "assets/equipment/experiments/material-equipment-v3/candidates/c/chitin/light-armour-full-set-v3.png",
			"sha256": "00ccb17097cbdd10bd14884d62d38976f853f1334f2c3643d663781b387ea027",
			"purpose": "Owner-accepted full Armour set; authoritative source for piece reconstruction."
		},
		{
			"path": "assets/equipment/experiments/material-equipment-v3/candidates/c/chitin/light-armour-legs-v3.png",
			"sha256": "5047b531dbddb3d80e6d303ac9124ece3f87d1a20bb1ed389fa2596ccc7e0919",
			"purpose": "First-pass Armour-piece candidate retained as immutable evidence; correct only the stated review issue."
		},
		{
			"path": "assets/equipment/experiments/material-equipment-v3/direction/class-progressions/light-armour-hide-scale-ranks-v3.png",
			"sha256": "4aeead1698bd2e6ba26e8c007c92248288c452b0254c4bb16fc09f4ca5e7a4a9",
			"purpose": "Requires owner checkpoint 1 acceptance for rank escalation, silhouettes, finish, camera, and empty-set treatment."
		},
		{
			"path": "assets/equipment/experiments/material-vs-class-calibration-2026-09-02/approach-a-steel-material-cohort-v1.png",
			"sha256": "6749ad1a65b995f48b89b0c1c8c8ee051da145315f5fd60775803f691ad7b887",
			"purpose": "Accepted painterly finish and cross-class material-coherence reference; do not copy geometry."
		}
	],
	"source": {
		"path": "/home/joao/.codex/generated_images/01a0684f-64a4-7b03-b972-37c15abd0c10/exec-cd0c059e-72ea-4396-910f-53aa48910049.png",
		"sha256": "d1870f003c93eb8fc8388fea5b222432f20537eeaabae345ca4de4ad03bd4625",
		"bytes": 1840539,
		"width": 1254,
		"height": 1254,
		"mediaType": "image/png"
	},
	"persistenceOperation": "exclusive-normalize",
	"output": {
		"path": "assets/equipment/experiments/material-equipment-v3/revisions/material-equipment-v3-chitin-light-armour-legs-v3/attempt-2/candidate.png",
		"sha256": "eb8af4ffcf931d36918d45dedda7ba863f896a12a31897e57e72b9e300c562f6",
		"bytes": 1367343,
		"width": 1024,
		"height": 1024,
		"mediaType": "image/png"
	},
	"error": null
}
