{
	"schemaVersion": "equipment-rank-first-provenance-result-v3",
	"resultId": "result-material-equipment-v3-drakescale-light-armour-legs-v3-attempt-1",
	"targetId": "material-equipment-v3-drakescale-light-armour-legs-v3",
	"assignmentId": "assignment-material-equipment-v3-drakescale-light-armour-legs-v3",
	"attempt": 1,
	"status": "failed",
	"startedAt": "2026-09-03T17:37:47.000Z",
	"completedAt": "2026-09-03T17:37:47.000Z",
	"provider": "OpenAI image generation",
	"model": "gpt-imagegen-2.0",
	"promptSha256": "f6e8d0cf20abcba402d17a370dc6cede8171a22088070435d9957e4b65a24c30",
	"references": [
		{
			"path": "assets/equipment/experiments/material-equipment-v3/direction/class-progressions/light-armour-hide-scale-ranks-v3.png",
			"sha256": "4aeead1698bd2e6ba26e8c007c92248288c452b0254c4bb16fc09f4ca5e7a4a9",
			"purpose": "Requires owner checkpoint 1 acceptance for rank escalation, silhouettes, finish, camera, and empty-set treatment."
		},
		{
			"path": "assets/equipment/experiments/material-vs-class-calibration-2026-09-02/approach-a-steel-material-cohort-v1.png",
			"sha256": "6749ad1a65b995f48b89b0c1c8c8ee051da145315f5fd60775803f691ad7b887",
			"purpose": "Accepted painterly finish and cross-class material-coherence reference; do not copy geometry."
		},
		{
			"path": "assets/equipment/experiments/material-equipment-v3/candidates/b/drakescale/light-armour-full-set-v3.png",
			"sha256": "175834e6870944b8226ad8d677ef94423a7237c82c5cfe23b9cc7c744bbb6663",
			"purpose": "Owner-accepted full Armour set; authoritative source for piece reconstruction."
		}
	],
	"source": null,
	"persistenceOperation": null,
	"output": null,
	"error": {
		"kind": "visual-contract-rejection",
		"message": "All 1 provider call(s) violated the four-piece Armour boundary; immutable source paths and hashes are recorded in assets/equipment/experiments/material-equipment-v3/reviews/armour-piece-withheld-calls-v1.json."
	}
}
